{
  "transaction_id": "ITXN_01J2K9QX4R8S6B7C5D3E1F0GJ3",
  "version": 1,
  "item_id": "ITEM_01J2K9QX4R8S6B7C5D3E1F0GJ1",
  "lot_id": "LOT_01J2K9QX4R8S6B7C5D3E1F0GJ2",
  "transaction_type": "USE_OUT",
  "quantity": {
    "value": 2,
    "unit": "瓶"
  },
  "from_location_id": "LOC_01J2K9QX4R8S6B7C5D3E1F0GJ4",
  "to_location_id": null,
  "unit_cost": {
    "amount": 68.5,
    "currency": "CNY"
  },
  "reason": "棚内病害防治领用",
  "related_task_id": "TASK_01J2K9QX4R8S6B7C5D3E1F0GHW",
  "occurred_at": "2026-07-12T09:00:00Z",
  "actor": {
    "actor_type": "HUMAN",
    "actor_id": "EMP_01J2K9QX4R8S6B7C5D3E1F0GHT",
    "effective_employee_id": "EMP_01J2K9QX4R8S6B7C5D3E1F0GHT",
    "agent_name": null,
    "agent_model": null
  },
  "source": {
    "source_type": "MANUAL",
    "source_id": "stock-001",
    "conversation_id": null,
    "message_id": null,
    "platform": null
  },
  "created_at": "2026-07-12T09:01:00Z",
  "content_hash": "sha256:aaaaaaaaaaaaaaaaaaaaaaaaaaaaaaaaaaaaaaaaaaaaaaaaaaaaaaaaaaaaaaaa"
}
